{
  "case_id": "relationship_diagram_005",
  "evaluation_mode": "image_vqa_0_2",
  "dimension_weights": {
    "grounded_requirement_satisfaction": 0.8,
    "visual_rendering_quality": 0.2
  },
  "grounded_requirement_satisfaction": {
    "vqa_items": [
      {
        "id": "grounded_q01",
        "question": "Which nodes, groups, or relationships does the diagram show for Solid mentor relationships?",
        "expected_answer": "Omar Reed -> Dana Liu | Priya Shah -> Dana Liu | Mina Cole -> Omar Reed",
        "acceptance_rule": "Accept semantically equivalent visible text. Allow capitalization, spacing, punctuation, and minor formatting differences; numbers, order, direction, units, and named entities must remain materially correct."
      },
      {
        "id": "grounded_q02",
        "question": "Which nodes, groups, or relationships does the diagram show for advisory edge?",
        "expected_answer": "Priya Shah | City Analytics Guild | dotted",
        "acceptance_rule": "Accept semantically equivalent visible text. Allow capitalization, spacing, punctuation, and minor formatting differences; numbers, order, direction, units, and named entities must remain materially correct."
      },
      {
        "id": "grounded_q03",
        "question": "Which nodes, groups, or relationships does the diagram show for Program lead node?",
        "expected_answer": "Dana Liu",
        "acceptance_rule": "Accept semantically equivalent visible text. Allow capitalization, spacing, punctuation, and minor formatting differences; numbers, order, direction, units, and named entities must remain materially correct."
      },
      {
        "id": "grounded_q04",
        "question": "Does the image actively present any prohibited, excluded, deprecated, or superseded content covered by Advisory group is not a manager? If yes, list it.",
        "expected_answer": "No",
        "acceptance_rule": "Only No earns credit; none of the prohibited content may be active in the final image. Prohibited evaluator-only references: City Analytics Guild as a direct manager."
      },
      {
        "id": "grounded_q05",
        "question": "How many distinct entries are visibly shown for Solid mentor relationships?",
        "expected_answer": "3",
        "acceptance_rule": "Accept the exact count when the entries are visibly distinct; words and digits are equivalent."
      },
      {
        "id": "grounded_q06",
        "question": "How many distinct entries are visibly shown for advisory edge?",
        "expected_answer": "3",
        "acceptance_rule": "Accept the exact count when the entries are visibly distinct; words and digits are equivalent."
      },
      {
        "id": "grounded_q07",
        "question": "Is the information for Solid mentor relationships visibly labeled and unambiguous in the image?",
        "expected_answer": "Yes",
        "acceptance_rule": "Accept Yes only when the relevant information is visibly present, identifiable, and not contradicted elsewhere in the image."
      },
      {
        "id": "grounded_q08",
        "question": "Is the information for advisory edge visibly labeled and unambiguous in the image?",
        "expected_answer": "Yes",
        "acceptance_rule": "Accept Yes only when the relevant information is visibly present, identifiable, and not contradicted elsewhere in the image."
      }
    ]
  },
  "visual_rendering_quality": {
    "image_type": "relationship_network",
    "vqa_items": [
      {
        "id": "visual_q01",
        "question": "As a relationship or mentorship network, can every important person or entity, role group, primary and advisory link type, label, and direction be traced without ambiguity through clean spatial organization and professional network-diagram craft?",
        "score_criteria": {
          "2": "Award 2 only if the network is exceptionally clear and presentation-ready: nodes and role groups are immediately distinguishable; primary, advisory, and any directional relationships use fully consistent and unmistakable encodings; important links remain traceable despite network density; labels are readable; spacing and grouping reveal structure; and connector routing is balanced with minimal tangling. The result must look deliberately composed, with no ambiguous direction, hidden edge, detached connector, illegible label, unstable node spacing, clipping, or rendering flaw. Any uncertain relationship prevents 2.",
          "1": "Award 1 if the network structure is understandable and usable, but it has visible imperfections such as some tangled links, small labels, weak role grouping, modest relationship-type distinction, uneven node spacing, or generally generic network styling.",
          "0": "Award 0 even if nodes and links are present when the network is visually difficult or unreliable to interpret: important connections cannot be traced, relationship types blend together, direction is ambiguous, labels are unreadable, layout is tangled, or substantial redesign is required. Blank, corrupted, severely unreadable, or materially incomplete networks are also 0."
        }
      }
    ]
  }
}
