{
  "case_id": "multi_source_fusion_005",
  "evaluation_mode": "image_vqa_0_2",
  "dimension_weights": {
    "grounded_requirement_satisfaction": 0.8,
    "visual_rendering_quality": 0.2
  },
  "grounded_requirement_satisfaction": {
    "vqa_items": [
      {
        "id": "grounded_q01",
        "question": "What synthesized result does the image present for Product to promote?",
        "expected_answer": "FocusLamp Go",
        "acceptance_rule": "Accept semantically equivalent visible text. Allow capitalization, spacing, punctuation, and minor formatting differences; numbers, order, direction, units, and named entities must remain materially correct."
      },
      {
        "id": "grounded_q02",
        "question": "What synthesized result does the image present for Supported points?",
        "expected_answer": "fold-flat stand | warm dimmable light | USB-C travel pouch",
        "acceptance_rule": "Accept semantically equivalent visible text. Allow capitalization, spacing, punctuation, and minor formatting differences; numbers, order, direction, units, and named entities must remain materially correct."
      },
      {
        "id": "grounded_q03",
        "question": "What synthesized result does the image present for Tone?",
        "expected_answer": "calm, portable, desk-friendly",
        "acceptance_rule": "Accept semantically equivalent visible text. Allow capitalization, spacing, punctuation, and minor formatting differences; numbers, order, direction, units, and named entities must remain materially correct."
      },
      {
        "id": "grounded_q04",
        "question": "Does the image actively present any prohibited, excluded, deprecated, or superseded content covered by Unsupported claims? If yes, list it.",
        "expected_answer": "No",
        "acceptance_rule": "Only No earns credit; none of the prohibited content may be active in the final image. Prohibited evaluator-only references: medical therapy | outdoor floodlight."
      },
      {
        "id": "grounded_q05",
        "question": "How many distinct entries are visibly shown for Supported points?",
        "expected_answer": "3",
        "acceptance_rule": "Accept the exact count when the entries are visibly distinct; words and digits are equivalent."
      },
      {
        "id": "grounded_q06",
        "question": "Is the information for Product to promote visibly labeled and unambiguous in the image?",
        "expected_answer": "Yes",
        "acceptance_rule": "Accept Yes only when the relevant information is visibly present, identifiable, and not contradicted elsewhere in the image."
      },
      {
        "id": "grounded_q07",
        "question": "Is the information for Supported points visibly labeled and unambiguous in the image?",
        "expected_answer": "Yes",
        "acceptance_rule": "Accept Yes only when the relevant information is visibly present, identifiable, and not contradicted elsewhere in the image."
      },
      {
        "id": "grounded_q08",
        "question": "Is the information for Tone visibly labeled and unambiguous in the image?",
        "expected_answer": "Yes",
        "acceptance_rule": "Accept Yes only when the relevant information is visibly present, identifiable, and not contradicted elsewhere in the image."
      }
    ]
  },
  "visual_rendering_quality": {
    "image_type": "social_campaign_creative",
    "vqa_items": [
      {
        "id": "visual_q01",
        "question": "As a customer-facing social campaign creative, does the image fuse the selected subject or product, audience-relevant setting, campaign message, approved benefit or proof, brand identity, and CTA into one distinctive, platform-native, highly polished feed composition?",
        "score_criteria": {
          "2": "Award 2 only if the creative is exceptional and ready for campaign deployment: the subject or product is unmistakably dominant; setting, message, proof, brand, and CTA reinforce one another in a single coherent concept; the crop feels native to the intended feed placement; essential text is readable at feed size; and imagery, typography, color, spacing, and finish are distinctive, premium, and meticulously controlled. No generic campaign template, weak subject focus, disconnected proof, competing copy, detached CTA, awkward crop, malformed text, or rendering flaw is allowed. Any meaningful campaign-quality concern prevents 2.",
          "1": "Award 1 if the creative is coherent, usable, and visually decent or attractive, but it remains ordinary or visibly imperfect—for example, generic styling, modest product or destination focus, disconnected proof points, competing copy, a weak CTA, or a slightly awkward crop.",
          "0": "Award 0 even when campaign elements are present if the output looks poor or fails to cohere: subject, setting, message, proof, brand, and CTA feel disconnected; focal hierarchy is weak; text or crop is badly handled; or the composition requires substantial redesign before use. Blank, corrupted, severely unreadable, or broken creatives are also 0."
        }
      }
    ]
  }
}
