{
  "case_id": "document_brief_002",
  "evaluation_mode": "image_vqa_0_2",
  "dimension_weights": {
    "grounded_requirement_satisfaction": 0.8,
    "visual_rendering_quality": 0.2
  },
  "grounded_requirement_satisfaction": {
    "vqa_items": [
      {
        "id": "grounded_q01",
        "question": "What public-facing information does the image show for Final public title or name to display?",
        "expected_answer": "HeatReady Block Walk",
        "acceptance_rule": "Accept exact wording and minor punctuation/case differences only; do not accept draft or internal names."
      },
      {
        "id": "grounded_q02",
        "question": "What public-facing information does the image show for Approved public date, schedule, or launch window?",
        "expected_answer": "Saturday, July 18, 2026, 9:30 AM-12:00 PM",
        "acceptance_rule": "Accept concise equivalent formatting that preserves the approved date/time/window."
      },
      {
        "id": "grounded_q03",
        "question": "What public-facing information does the image show for Responsible public lead organization or team?",
        "expected_answer": "Eastside Resilience Office",
        "acceptance_rule": "Accept the named lead with minor wording variation; do not replace it with partners, sponsors, guests, or sales contributors."
      },
      {
        "id": "grounded_q04",
        "question": "What public-facing information does the image show for Target audience or public context requested by task.md?",
        "expected_answer": "renters, older adults, and neighborhood volunteers in the Eastside flats",
        "acceptance_rule": "Accept close paraphrases that preserve the intended public audience/context."
      },
      {
        "id": "grounded_q05",
        "question": "What public-facing information does the image show for Exactly three poster-safe highlights, claims, findings, or takeaways?",
        "expected_answer": "Map shaded rest stops and water refill points | Practice a door-to-door heat check-in script | Take home a cooling resource card for neighbors",
        "acceptance_rule": "Accept concise paraphrases of the three approved items. The image should include exactly three, not a longer list."
      },
      {
        "id": "grounded_q06",
        "question": "Does the image actively present any prohibited, excluded, deprecated, or superseded content covered by Draft or internal titles/names must not be used as the public headline? If yes, list it.",
        "expected_answer": "No",
        "acceptance_rule": "Only No earns credit; none of the prohibited content may be active in the final image. Prohibited evaluator-only references: Summer Safety Canvass | Heat Check Day | Cool Streets Sprint."
      },
      {
        "id": "grounded_q07",
        "question": "Does the image actively present any prohibited, excluded, deprecated, or superseded content covered by Old, replaced, or tentative timing must not be used? If yes, list it.",
        "expected_answer": "No",
        "acceptance_rule": "Only No earns credit; none of the prohibited content may be active in the final image. Prohibited evaluator-only references: June 27 morning walk."
      },
      {
        "id": "grounded_q08",
        "question": "Does the image actively present any prohibited, excluded, deprecated, or superseded content covered by Internal, pending, unpublished, or unsupported details must not appear? If yes, list it.",
        "expected_answer": "No",
        "acceptance_rule": "Only No earns credit; none of the prohibited content may be active in the final image. Prohibited evaluator-only references: Northline Energy sponsor | gift cards | venue TBA or cap of 40."
      }
    ]
  },
  "visual_rendering_quality": {
    "image_type": "public_information_poster",
    "vqa_items": [
      {
        "id": "visual_q01",
        "question": "As a public-information, recruitment, route, award, community, advocacy, or detour poster, does the image transform the public message into an immediately understandable, visually purposeful, and publication-ready poster rather than merely placing readable text into a document-like layout? Judge the clarity of the main takeaway, audience and applicable time, place, route, status, or action details; the strength of visual hierarchy and information grouping; the meaningful use of the full canvas; the suitability of visual devices for the message; and the overall accessibility, specificity, polish, and public-facing credibility.",
        "score_criteria": {
          "2": "Award 2 only for an exceptional, professionally art-directed poster that is ready for prominent public distribution without revision. The main public takeaway and any applicable action, audience, time, place, route, award, status, or community detail must be understood within seconds through a decisive focal point and a clearly differentiated reading sequence. Information must be visually synthesized rather than merely listed: typography, scale, grouping, icons, imagery, diagrams, maps, emphasis devices, or other graphic elements must meaningfully help viewers distinguish priorities, categories, routes, winners, changes, or actions. The full canvas must feel intentionally composed, with strong balance, controlled density, efficient use of space, refined alignment, consistent spacing, accessible contrast, and polished margins. The design must feel specific to the message and audience, not like a generic report, slide, form, spreadsheet, or repeated-card template. All visible text must remain comfortably readable at normal viewing size, and no malformed glyph, weak contrast, clipping, overlap, accidental crop, decorative distraction, inconsistent styling, or production residue is allowed. Large dead zones, excessive unused space, monotonous repeated boxes, text-only document composition, weak visual storytelling, generic template styling, or any section that appears unfinished automatically prevents 2.",
          "1": "Award 1 if the poster is understandable, usable, and visually acceptable or good, but it remains visibly underdesigned or would require professional refinement before prominent public release. This includes clean but document-like or slide-like layouts; mostly textual lists placed inside repeated cards; limited meaningful imagery or visual encoding; weak distinction between primary and secondary information; ordinary or generic styling; excessive empty space; uneven use of the canvas; monotonous section treatment; modest action or takeaway emphasis; small supporting text; or minor spacing, accessibility, balance, and consistency issues. A poster may be fully legible and free of rendering defects yet still receive only 1 when its visual communication is basic rather than exceptional.",
          "0": "Award 0 if the poster is visually poor, unreliable, or not practically suitable for public use. This includes cases where the essential message, affected audience, applicable timing, location, route, status, or action is difficult to identify; hierarchy and grouping are confusing; typography or contrast materially harms reading; the composition is severely unbalanced or unfinished; decoration competes with information; visual encoding is misleading; or substantial redesign is needed for dependable public communication. Blank, corrupted, severely unreadable, materially misleading, clipped, overlapping, or otherwise broken posters are also 0."
        }
      }
    ]
  }
}
