{
  "case_id": "data_insight_004",
  "evaluation_mode": "image_vqa_0_2",
  "dimension_weights": {
    "grounded_requirement_satisfaction": 0.8,
    "visual_rendering_quality": 0.2
  },
  "grounded_requirement_satisfaction": {
    "vqa_items": [
      {
        "id": "grounded_q01",
        "question": "Which route corridor is shown as the top attention priority, and what score is attached to it?",
        "expected_answer": "Hill Connector — 84.0",
        "acceptance_rule": "Accept Hill Connector with a score near 84.0; case, spacing, and minor rounding differences are allowed."
      },
      {
        "id": "grounded_q02",
        "question": "Which route corridor is shown as the lowest-attention comparison, and what score is attached to it?",
        "expected_answer": "Harbor Shuttle — 3.9",
        "acceptance_rule": "Accept Harbor Shuttle with a score near 3.9; case, spacing, and minor rounding differences are allowed."
      },
      {
        "id": "grounded_q03",
        "question": "Which corridor is shown as having the fastest worsening reliability rate, and by how much?",
        "expected_answer": "Hill Connector — about +7.0 percentage points",
        "acceptance_rule": "Accept Hill Connector with approximately +7.0 pp or percentage points; do not treat 7.0% as equivalent unless clearly labeled as a percentage-point change."
      },
      {
        "id": "grounded_q04",
        "question": "Which corridor is shown as having the largest late-or-missed trip count, and what count is shown?",
        "expected_answer": "Airport Rapid — about 780 trips",
        "acceptance_rule": "Accept Airport Rapid with approximately 780 late-or-missed trips; minor label or number-format differences are allowed."
      },
      {
        "id": "grounded_q05",
        "question": "Which corridor is shown as having the strongest crowding pressure, and what rate is shown?",
        "expected_answer": "Campus Loop — about 46.4 per 10,000 boardings",
        "acceptance_rule": "Accept Campus Loop with approximately 46.4 per 10,000; the denominator must be visible or unambiguous."
      },
      {
        "id": "grounded_q06",
        "question": "Which service district is shown as having the largest reliability gap, and what value is shown?",
        "expected_answer": "Core — about 1,080 late-or-missed trips",
        "acceptance_rule": "Accept Core with approximately 1080 or 1,080 late-or-missed trips; it must be presented as the leading district rather than a corridor."
      },
      {
        "id": "grounded_q07",
        "question": "How many route corridors are shown in the top attention band?",
        "expected_answer": "3",
        "acceptance_rule": "Accept 3 or three when clearly labeled as the top-attention corridor count."
      },
      {
        "id": "grounded_q08",
        "question": "Does the image present any excluded, invalid, contextual, or non-final material as final service metrics?",
        "expected_answer": "No",
        "acceptance_rule": "This is a reverse-scored prohibition check. Only No earns credit. Benign notes explicitly identifying excluded context are allowed."
      }
    ]
  },
  "visual_rendering_quality": {
    "image_type": "data_story_infographic",
    "vqa_items": [
      {
        "id": "visual_q01",
        "question": "As a data-story infographic, does the image communicate one dominant insight through an immediately legible narrative sequence, well-chosen visual evidence, meaningful comparisons, a clear takeaway, and refined publication-quality composition rather than a collection of disconnected cards?",
        "score_criteria": {
          "2": "Award 2 only if the infographic is outstanding and publication-ready: one main insight dominates immediately; evidence, comparisons, annotations, and conclusion form a persuasive visual sequence; charts or encodings are purposeful, proportionate, and easy to interpret; all labels, values, units, and notes are readable at normal size; typography, spacing, color, alignment, and density are consistently sophisticated; and the page feels custom-designed, cohesive, and visually memorable without sacrificing accuracy or clarity. There must be no meaningful clutter, generic KPI-card dumping, weak takeaway, misleading encoding, malformed text, clipping, overlap, or rendering residue. Any notable narrative or design weakness prevents 2.",
          "1": "Award 1 if the infographic is understandable and reasonably well designed, with a visible main message and usable evidence, but it remains ordinary or imperfect—for example, a weak reading order, limited comparison, crowded charts, generic cards, uneven emphasis, small annotations, or a takeaway that is present but not visually decisive.",
          "0": "Award 0 even if the required numbers appear when the overall visual story fails: there is no clear dominant insight, the page reads as a cluttered dashboard or raw report, comparisons are hard to interpret, charts or labels are confusing, hierarchy is weak, or the composition looks visibly poor and needs substantial redesign. Blank, corrupted, severely unreadable, materially misleading, or largely incoherent outputs are also 0."
        }
      }
    ]
  }
}
