{
  "case_id": "relationship_diagram_002",
  "evaluation_mode": "image_vqa_0_2",
  "dimension_weights": {
    "grounded_requirement_satisfaction": 0.8,
    "visual_rendering_quality": 0.2
  },
  "grounded_requirement_satisfaction": {
    "vqa_items": [
      {
        "id": "grounded_q01",
        "question": "Which nodes, groups, or relationships does the diagram show for Core intake nodes?",
        "expected_answer": "Supplier Portal | Intake API | Compliance Service | Vendor Database | Onboarding Queue | Onboarding Worker | Ticketing System",
        "acceptance_rule": "Accept semantically equivalent visible text. Allow capitalization, spacing, punctuation, and minor formatting differences; numbers, order, direction, units, and named entities must remain materially correct."
      },
      {
        "id": "grounded_q02",
        "question": "Which nodes, groups, or relationships does the diagram show for Directed intake flow relationships?",
        "expected_answer": "Supplier Portal -> Intake API | Intake API -> Compliance Service | Intake API -> Vendor Database | Intake API -> Onboarding Queue | Onboarding Worker -> Onboarding Queue | Onboarding Worker -> Ticketing System",
        "acceptance_rule": "Accept semantically equivalent visible text. Allow capitalization, spacing, punctuation, and minor formatting differences; numbers, order, direction, units, and named entities must remain materially correct."
      },
      {
        "id": "grounded_q03",
        "question": "Which nodes, groups, or relationships does the diagram show for Relationship types should be represented or implied?",
        "expected_answer": "sends | validates | writes | publishes | consumes | creates",
        "acceptance_rule": "Accept semantically equivalent visible text. Allow capitalization, spacing, punctuation, and minor formatting differences; numbers, order, direction, units, and named entities must remain materially correct."
      },
      {
        "id": "grounded_q04",
        "question": "Does the image actively present any prohibited, excluded, deprecated, or superseded content covered by exclude analytics? If yes, list it.",
        "expected_answer": "No",
        "acceptance_rule": "Only No earns credit; none of the prohibited content may be active in the final image. Prohibited evaluator-only references: Analytics Export."
      },
      {
        "id": "grounded_q05",
        "question": "How many distinct entries are visibly shown for Core intake nodes?",
        "expected_answer": "7",
        "acceptance_rule": "Accept the exact count when the entries are visibly distinct; words and digits are equivalent."
      },
      {
        "id": "grounded_q06",
        "question": "How many distinct entries are visibly shown for Directed intake flow relationships?",
        "expected_answer": "6",
        "acceptance_rule": "Accept the exact count when the entries are visibly distinct; words and digits are equivalent."
      },
      {
        "id": "grounded_q07",
        "question": "How many distinct entries are visibly shown for Relationship types should be represented or implied?",
        "expected_answer": "6",
        "acceptance_rule": "Accept the exact count when the entries are visibly distinct; words and digits are equivalent."
      },
      {
        "id": "grounded_q08",
        "question": "Is the information for Core intake nodes visibly labeled and unambiguous in the image?",
        "expected_answer": "Yes",
        "acceptance_rule": "Accept Yes only when the relevant information is visibly present, identifiable, and not contradicted elsewhere in the image."
      }
    ]
  },
  "visual_rendering_quality": {
    "image_type": "data_flow_diagram",
    "vqa_items": [
      {
        "id": "visual_q01",
        "question": "As a directed data-flow diagram, can a viewer visually trace every important movement from source to destination through clearly differentiated systems, processes, stores or queues, labels, arrows, and scope boundaries, with disciplined routing and professional diagram polish?",
        "score_criteria": {
          "2": "Award 2 only if the diagram is exceptionally clear and production-ready: every node, label, arrowhead, data-flow name, store or queue, and boundary is readable at normal size; direction is unmistakable end to end; node roles are visually distinct; routing is economical, balanced, and nearly free of crossings; spacing and alignment create a calm, deliberate structure; and no connector appears detached, ambiguous, broken, hidden, clipped, or visually misleading. The diagram must look deliberately engineered, not merely auto-laid-out. Any uncertainty in flow direction, role distinction, or cleanup prevents 2.",
          "1": "Award 1 if the main flow can be followed and the diagram is substantially usable, but it has one or more visible weaknesses such as avoidable crossings, slightly ambiguous arrows, inconsistent node shapes, dense labels, weak boundaries, uneven spacing, or a generic auto-generated appearance. It may be decent, but not exemplary.",
          "0": "Award 0 even if nodes and arrows are present when the diagram is visually weak enough to require major redesign: important paths are difficult to trace, arrow direction is ambiguous, connectors collide or detach, node roles are confusing, labels are too small or crowded, scope is unclear, or the layout is chaotic, crude, or misleading. Blank, corrupted, severely unreadable, or materially incomplete diagrams are also 0."
        }
      }
    ]
  }
}
